{
  "$schema": "https://json-schema.org/draft/2020-12/schema",
  "$id": "https://contracts.making-tracks.app/place/1",
  "title": "Place",
  "description": "Read-only place record delivered inside a tile. Fields per spec §5.4; caps per §5.5.",
  "type": "object",
  "additionalProperties": false,
  "required": ["place_id", "name", "lat", "lon", "category", "tier", "score", "source_refs"],
  "properties": {
    "place_id": {"type": "string", "pattern": "^mt1_[0-9ABCDEFGHJKMNPQRSTVWXYZ]{26}$"},
    "name": {"type": "string", "minLength": 1, "maxLength": 200, "pattern": "^[^\\u0000-\\u001f\\u007f]*$"},
    "alt_names": {"type": "array", "maxItems": 8, "items": {"type": "string", "minLength": 1, "maxLength": 200, "pattern": "^[^\\u0000-\\u001f\\u007f]*$"}},
    "lat": {"type": "number", "minimum": -90, "maximum": 90},
    "lon": {"type": "number", "minimum": -180, "maximum": 180},
    "category": {"type": "string", "minLength": 1, "maxLength": 64, "pattern": "^[^\\u0000-\\u001f\\u007f]*$"},
    "tier": {"type": "integer", "minimum": 1, "maximum": 4},
    "score": {"type": "number", "minimum": 0, "maximum": 1},
    "blurb": {"type": ["string", "null"], "maxLength": 600},
    "image_url": {"type": ["string", "null"], "maxLength": 2048, "pattern": "^https://"},
    "wikipedia_title": {"type": ["string", "null"], "maxLength": 300},
    "source_refs": {
      "type": "array",
      "minItems": 1,
      "maxItems": 64,
      "uniqueItems": true,
      "items": {"type": "string", "maxLength": 128, "pattern": "^(wd|osm|hehle|plaque):[^\\u0000-\\u001f\\u007f]+$"}
    }
  }
}
